{
  "$schema": "http://json-schema.org/draft-07/schema#",
  "description": "List of Non-Fungible Token history events",
  "title": "NonFungibleTokenHistoryEventList",
  "type": "object",
  "required": [
    "results",
    "limit",
    "offset",
    "total"
  ],
  "additionalProperties": false,
  "properties": {
    "limit": {
      "type": "integer",
      "maximum": 200,
      "description": "The number of events to return"
    },
    "offset": {
      "type": "integer",
      "description": "The number to events to skip (starting at `0`)"
    },
    "total": {
      "type": "integer",
      "description": "The number of events available"
    },
    "results": {
      "type": "array",
      "items": {
        "$ref": "../../entities/tokens/non-fungible-token-history-event.schema.json"
      }
    }
  }
}
