{
  "limit": 20,
  "offset": 0,
  "total": 0,
  "results": [
    {
      "event_index": 0,
      "event_type": "stx_asset",
      "tx_id": "0xb31df5a363dad31723324cb5e0eefa04d491519fd30827a521cbc830114aa50c",
      "asset": {
        "asset_event_type": "transfer",
        "sender": "STB44HYPYAT2BB2QE513NSP81HTMYWBJP02HPGK6",
        "recipient": "ST2TJRHDHMYBQ417HFB0BDX430TQA5PXRX6495G1V",
        "amount": "500000"
      }
    }
  ]
}
