{
  "limit": 200,
  "offset": 0,
  "total": 2,
  "results": [
    {
      "stacker": "SPDGWQ60E1QXTC6E4VHKK0NG34EAX554WDFFFHMF",
      "pox_addr": "bc1qxhmdufsvnuaaaer4ynz88fspdsxq2h9e9cetdj",
      "amount_ustx": "2062697998",
      "burn_block_unlock_height": 781984,
      "block_height": 65917,
      "tx_id": "0x3c81cd26ed172a7e552ed245b8b290abefa4f82dfc610a0091ac91c2eed7f9e6"
    },
    {
      "stacker": "SP7RNXF7YBSS43TECXTHF7W1MAB221WWW8RKPGSN",
      "pox_addr": "1Di1YoMov6Ua3gPedfQz7TkP6iTLqbPUzi",
      "amount_ustx": "4815793194",
      "block_height": 65910,
      "tx_id": "0x1692cd26ed172a7e552ed245b8b290abefa4f82dfc610a0091ac91c2eed7f9e6"
    }
  ]
}
