{
	"limit": 50,
	"offset": 0,
	"total": 3,
	"results": [
		{
			"asset_identifier": "SP2X0TZ59D5SZ8ACQ6YMCHHNR2ZN51Z32E2CJ173.the-explorer-guild::The-Explorer-Guild",
			"value": {
				"hex": "0x0100000000000000000000000000000803",
				"repr": "u2051"
			},
			"tx_id": "0x12e6f88724d0e630de26c376f172cf1781e25435e2b4ee54d36a949b244e429c"
		},
		{
			"asset_identifier": "SP2BE8TZATXEVPGZ8HAFZYE5GKZ02X0YDKAN7ZTGW.arties::arties",
			"value": {
				"hex": "0x01000000000000000000000000000004f3",
				"repr": "u1267"
			},
			"tx_id": "0xddc464c5e20a78dc5ac351913e0d9b9cce76fc955cc4599e0cccad960998f130"
		},
		{
			"asset_identifier": "SP000000000000000000002Q6VF78.bns::names",
			"value": {
				"hex": "0x0c00000002046e616d65020000000672616661656c096e616d6573706163650200000003627463",
				"repr": "(tuple (name 0x72616661656c) (namespace 0x627463))"
			},
			"tx_id": "0x0153a41ed24a0e1d32f66ea98338df09f942571ca66359e28bdca79ccd0305cf"
		}
	]
}
