{
  "limit": 1,
  "offset": 0,
  "total": 21707,
  "results": [
    {
      "canonical": true,
      "height": 21698,
      "hash": "0x9be3e38eab9c7d094fd51792383c66706838d6392e95bc05cc730b8f7520e352",
      "parent_block_hash": "0x76ee36d1d6c88e56b5c0e80f0d7bc7d3492141faf1b900efb19fcd00457d4654",
      "burn_block_time": 1626281749,
      "burn_block_time_iso": "2021-07-14T16:55:49.000Z",
      "burn_block_hash": "0x0000000000000000000ea16f8e906e85ee1cb4dff1e5424e93843b3cec8b0bcb",
      "burn_block_height": 691014,
      "miner_txid": "0x118f7122a69441d13e6a3dfd4c3b0f9950be25195bb8126aae7fadea1aa9185d",
      "txs": [
        "0x76f58b2eaff65a07a5971b241c4e71fee92ee0f9396809f911f90839f9004cac",
        "0x32972d9052b068f218f6e13451f7aff937099b74bbf95fac7d9402295b1b3941",
        "0x8cd30724c02a9cc1d8879a34dc136ebfdb2008420badcfb5947b92f85ebce79b",
        "0xf5c1577f42d3753a508101e045dd2dc60491eb0aa552e0ecd0ad37cc697143f4",
        "0x35e4c20e2838f999e0cf0b40c5fabce154c2df1912a1074150d26784c53f7a20",
        "0x501eb42b82e5b7a7350b47fa143cd4e90bb46d43e4a7d22830b2bf2aa70b7922"
      ]
    }
  ]
}
