{
  "limit": 1,
  "offset": 0,
  "total": 21707,
  "results": [
    {
      "burn_block_time": 1626281749,
      "burn_block_time_iso": "2021-07-14T16:55:49.000Z",
      "burn_block_hash": "0x0000000000000000000ea16f8e906e85ee1cb4dff1e5424e93843b3cec8b0bcb",
      "burn_block_height": 691014,
      "stacks_blocks_count": 10
    }
  ]
}
