{
  "limit": 20,
  "offset": 0,
  "total": 2,
  "results": [
    {
        "canonical": true,
        "burn_block_hash": "0x4eaabcd105865e471f697eff5dd5bd85d47ecb5a26a3379d74fae0ae87c40904",
        "burn_block_height": 331,
        "address": "1C56LYirKa3PFXFsvhSESgDy2acEHVAEt6",
        "slot_index": 0
    },
    {
      "canonical": true,
      "burn_block_hash": "0x4eaabcd105865e471f697eff5dd5bd85d47ecb5a26a3379d74fae0ae87c40904",
      "burn_block_height": 331,
      "address": "1M3bvWB9CRh5BTumeVxtHDEV6W4S2R9AZw",
      "slot_index": 0
    }
  ]
}
